Judul yang Diuji,Run_01_ms,Run_02_ms,Run_03_ms,Run_04_ms,Run_05_ms,Run_06_ms,Run_07_ms,Run_08_ms,Run_09_ms,Run_10_ms,Run_11_ms,Run_12_ms,Run_13_ms,Run_14_ms,Run_15_ms,Run_16_ms,Run_17_ms,Run_18_ms,Run_19_ms,Run_20_ms,Run_21_ms,Run_22_ms,Run_23_ms,Run_24_ms,Run_25_ms,Run_26_ms,Run_27_ms,Run_28_ms,Run_29_ms,Run_30_ms,Rata_rata_ms
Diplomasi Indonesia dalam Mendukung Kemerdekaan Palestina,7.5371,4.8835,4.816,4.6043,4.2579,5.0906,4.7886,7.4135,6.3644,5.9449,8.5448,6.2214,5.8867,4.4598,7.6167,6.8731,9.9599,5.9043,6.2752,5.431,6.1466,9.6567,7.6071,7.2587,7.6485,5.7421,4.5119,4.6119,4.5726,4.5058,6.171187
Ali & Lili,1.6364,1.739,1.8123,1.5994,1.5989,1.6658,1.5894,1.6424,1.592,1.6657,1.6934,1.5197,1.9016,1.8434,1.9384,1.6275,1.698,1.595,1.6673,1.6611,2.4472,3.5889,1.9002,1.6896,2.7937,1.598,1.5157,1.5135,1.779,2.3074,1.82733
Ide-Ide Pemikiran dari Kampus Maroon 2024,4.8812,3.3206,3.7726,4.5762,3.3221,3.6158,6.206,3.9346,4.3957,3.6285,4.1448,3.7401,5.4849,3.7094,3.7205,4.3999,3.5792,3.8737,6.5515,5.2509,3.91,7.6289,4.2484,5.2279,3.4418,4.1913,5.4719,3.6757,8.0052,5.3512,4.57535
Mitigasi Risiko Proyek Konstruksi di Indonesia,4.649,4.9693,4.4481,3.9941,4.0885,4.4231,4.3283,4.1316,4.1485,6.114,3.9943,4.1754,4.7575,4.2557,4.0146,4.1343,5.501,4.1878,4.5408,4.9929,4.3737,4.2088,4.7782,4.6332,4.138,4.153,4.9392,4.3004,4.156,4.3083,4.461253
"Manajemen Sumber Daya Manusia: Berbasis Teknologi, Menuju Ekosistem Hijau dan SDGs",5.2557,6.4194,10.8907,7.085,7.1948,5.4509,6.0771,7.1403,5.4536,7.4698,8.4064,6.2695,5.3469,5.3291,7.3825,11.1991,6.0884,5.2695,6.5002,10.4189,8.1448,5.555,5.3215,7.1647,9.7181,5.359,5.8908,5.2858,5.3018,5.5284,6.797257
Akal Yang Mengandung Hikmat,2.4172,2.116,2.7165,2.1812,2.278,2.153,2.1205,2.1668,2.1841,3.532,2.2023,2.8456,3.0728,3.2405,2.2428,2.0979,2.2926,2.379,2.363,2.2643,2.0742,2.1232,3.0185,3.4278,3.8443,3.4521,2.4469,2.2777,2.4015,2.1352,2.535583
79 Esai Aksi Bersama Wujudkan 17 SDGs,1.8145,1.5667,1.5833,2.4365,2.1576,2.1865,2.4519,4.0636,1.5756,1.281,1.4238,1.8509,1.4571,1.3551,1.3267,1.2837,1.476,1.558,1.9508,2.5826,1.3363,2.0674,2.167,2.5775,1.4732,1.5654,1.7676,1.2903,1.2838,1.2735,1.80613
Penghargaan Achmad Bakrie XX-2024,5.5625,8.2008,6.7655,6.2862,5.5013,5.3883,5.052,9.8703,5.936,6.1117,5.6694,5.9475,6.0479,8.0704,9.9728,7.7803,7.8314,5.0671,8.9085,7.1131,5.2602,6.7848,6.4829,5.7116,7.2511,6.6945,5.3089,9.0442,5.2741,5.2603,6.671853
Arunika: Bunga Rampai Ilmu Komunikasi Perilaku Komunikasi Gen Z  Seri 2,5.4174,5.2025,5.3259,4.7726,5.0511,6.0855,9.2558,5.0554,8.1669,9.8695,4.5922,4.6047,5.7132,10.9173,11.4871,11.1515,11.0391,5.3836,7.1594,6.1674,5.3281,4.6038,5.9846,4.7275,4.7094,5.321,4.9551,7.3024,6.1851,6.4283,6.59878
Belajar Hidup Minim Sampah Mulai Dari Dapur Rumah,3.6436,4.9139,8.1813,5.0419,3.7166,4.13,3.513,4.0117,4.0067,11.6642,5.235,4.5096,3.67,3.6975,6.6851,4.7698,4.9918,4.6938,4.377,3.348,4.2783,6.5115,4.8725,4.2699,5.4297,5.3062,3.8774,3.6791,3.5515,5.2814,4.861933
Desain Percobaan: Teori dan Aplikasi,3.5995,5.5028,4.21,3.7224,3.903,3.7045,3.5764,4.2143,3.6971,3.6344,4.3159,4.7687,4.2911,3.5693,3.4543,3.5193,7.9996,3.5631,5.7329,3.8569,3.5679,3.6715,3.6027,3.2244,3.6024,4.084,3.219,3.5505,3.2648,3.5325,4.005173
"Wanita Masa Depan: Peran, Identitas, Dan Kontribusi Dalam Menghadapi Tantangan Kehidupan",4.9543,3.6909,3.5973,3.5641,4.0172,3.7013,3.504,5.26,3.726,3.8389,3.7955,3.4792,3.7204,3.6035,3.5376,3.4911,3.4073,3.901,4.7688,8.6175,4.9482,3.6091,3.4115,3.6316,3.6657,7.9837,4.9982,3.8092,3.869,3.4404,4.18475
Jalan Kebijaksanaan: Mengatasi Kesulitan Dan Menginspirasi Kehidupan,8.8009,4.545,4.5137,5.6354,4.272,4.2357,4.1308,8.1532,4.5081,9.0057,4.1736,6.6638,4.1573,4.3671,4.4503,6.1466,4.1154,4.2647,5.621,4.4752,4.7203,8.468,4.3418,7.4038,6.483,6.1754,8.8108,6.4216,8.1353,5.3824,5.752597
Cerita dari Perguruan Tinggi,5.4099,3.9634,3.3739,5.63,3.7283,3.4569,3.571,3.1935,2.857,3.2712,3.0139,3.1749,2.8436,3.5811,4.4406,2.9598,3.2154,2.8576,3.0583,3.1217,3.2505,2.8504,7.032,2.881,2.979,3.4819,3.8973,3.4738,3.0201,9.5851,3.772437
Tinjauan Teknis Kajian Prastudi Kelayakan Proyek KPBU Fasilitas Pengelolaan Limbah Bahan Berbahaya dan Beracun dan Sampah Spesifik Secara Terpadu Kalimantan Timur,9.6714,9.5189,8.6276,6.8966,9.8316,6.4788,5.6211,8.9369,6.4709,5.4863,5.5406,7.5685,6.4148,5.676,6.5031,6.2536,9.099,6.5165,5.5142,5.9805,8.2842,7.6677,8.1352,8.8383,5.7778,5.5718,9.56,9.2676,6.1922,5.7037,7.253513
Global Organic Agricultural Innovations,3.16,4.1721,3.7279,3.2311,5.3229,10.9029,3.148,3.1665,3.7318,4.1723,3.7165,4.4816,5.7063,4.942,5.1333,4.4798,3.6689,7.4584,3.7154,3.9485,3.4934,4.1612,4.0625,4.1926,3.1705,3.3239,7.6395,3.2473,3.3077,3.526,4.403693
Arunika: Bunga Rampai Ilmu Komunikasi Perilaku Komunikasi Gen Z,7.5156,5.2974,5.9239,4.5675,4.5339,6.841,5.8515,7.5627,4.8284,4.469,4.6978,4.7592,4.3463,4.3646,6.7445,4.5855,8.5689,5.3719,4.9416,4.4777,5.9142,4.588,4.2673,5.1703,5.7067,4.5487,4.9135,4.3112,5.2207,8.2756,5.438837
Cerita Para Mahasiswa,3.7968,3.2891,3.1638,2.8895,3.0515,2.8485,6.843,2.8421,3.0479,6.3331,4.263,3.3949,5.0967,7.1286,2.8932,3.3524,6.0106,2.934,3.9908,3.9991,3.338,3.3206,3.13,5.0879,3.0339,3.1145,3.0306,3.3143,3.4195,3.0541,3.833733
Cerita Semasa Kuliah,3.6039,2.9875,3.0791,3.4343,3.1727,3.2251,3.4369,2.9905,7.6831,3.1685,5.4321,4.2075,2.8382,3.5573,3.447,5.4406,3.3942,3.1732,3.2933,5.4038,3.2302,7.1493,5.7819,4.8566,3.41,3.303,5.7548,4.9744,3.2371,3.9355,4.08672
Cerdas Mengelola Kebun Hingga Sampai Dapur,3.9024,5.8882,5.0736,3.1746,4.0168,3.7746,3.8785,3.5573,3.0904,3.3924,3.1799,6.7344,3.1899,3.2622,3.4225,4.4539,3.3488,3.5788,4.2576,4.4349,3.5521,3.226,4.887,4.1957,4.2751,3.5091,3.4333,3.1051,3.7532,3.1742,3.89075
Statistik Pertanian Organik Indonesia,6.8576,5.7681,6.7222,5.1576,5.3412,8.0332,4.5176,7.1726,4.9729,4.7568,4.5476,4.4337,4.3346,4.8803,5.0941,4.5508,4.7917,4.3273,4.3338,4.44,5.0503,4.3447,4.4435,4.7121,5.7914,5.4559,5.1293,7.3494,4.7255,4.5963,5.22107
Arunika: Bunga Rampai Ilmu Komunikasi All About Communities,9.8617,4.9961,6.2637,4.528,4.8262,4.7435,4.6093,5.0075,5.0819,4.7264,4.6694,5.7401,4.6728,7.6481,4.4657,4.5407,5.4399,5.0444,5.1623,4.9099,4.5678,4.3462,5.2432,4.3897,4.5253,4.3654,4.6268,4.5013,4.5066,4.5618,5.085723
"Meningkatkan Produktivitas: Panduan Praktis Untuk Sukses Dalam Pekerjaan, Karier Dan Kehidupan Anda",8.9208,7.7321,7.1292,7.0294,7.5096,8.2401,10.4757,7.0405,7.5442,7.5532,7.9364,7.2589,6.6275,7.4731,9.0382,6.8837,8.4775,7.3547,6.7732,6.7802,6.5394,6.674,7.2647,7.6599,7.5298,7.6531,7.9366,6.7218,6.8983,10.9873,7.65477
Proyek Tepat Waktu: Menyingkap Faktor Keterlambatan Dan Solusi Proyek Konstruksi Di Indonesia,4.354,4.3502,3.7881,3.66,5.0705,4.17,5.1417,6.2244,5.7631,3.488,3.4634,4.5189,5.4594,5.2587,4.2652,4.1013,3.88,3.4674,4.0128,3.9454,3.4738,3.5669,3.6557,7.7011,3.4021,3.9135,3.6774,3.5843,3.4283,3.7097,4.283177
Buku Panduan Pemilu 2024: Edisi Pemilih Disabilitas,2.228,2.1035,5.6539,2.4124,2.1056,2.0997,2.3374,2.5501,3.0308,3.1452,2.2306,7.6677,2.1823,2.7377,2.3058,2.4691,2.607,2.6082,2.3754,2.1104,2.0966,2.8026,2.2278,2.3609,2.4681,2.1796,3.8977,2.0877,2.3431,2.3554,2.72601
Data Structure Vol. 1,2.505,2.45,3.0362,2.4684,2.708,2.4581,2.8081,2.4787,2.8,2.7351,2.4769,2.6994,2.4665,2.7702,3.4515,2.5429,3.3239,2.7487,2.4635,2.7783,6.2701,2.5774,2.6263,2.8699,2.4523,2.6419,2.9794,2.6882,2.4656,2.7385,2.815967
"Analisis Sumber Daya Manusia, Pengangguran Dan Kemiskinan Di Indonesia",7.6537,4.139,6.4701,7.8725,4.8018,4.0684,4.2585,6.009,4.9863,4.7618,4.6899,4.7456,4.2603,4.4461,5.5234,4.8655,4.1379,3.9419,6.9213,3.9578,4.2315,9.8434,7.8877,4.527,8.2998,5.977,4.9782,5.1559,10.5731,6.6796,5.6888
Reorientasi Kebijakan Pertanian Organik Sesudah Go Organik 2010 dan Program Seribu Desa Pertanian Organik di Indonesia,10.3888,8.11,8.1672,10.7333,7.9114,8.2528,9.2762,7.4225,9.7118,6.8837,8.6876,7.9223,7.8473,7.3514,6.3791,9.4431,10.5635,9.9664,7.0051,6.5543,8.2973,9.322,6.1949,8.0242,6.2513,9.2101,10.2499,7.2528,10.8706,12.9307,8.57272
Pemanfaatan Ekowisata sebagai Strategi City Branding Kabupaten Pinrang,6.1731,7.6347,6.4654,5.9025,7.0366,6.6275,7.0168,7.4699,6.5844,6.9022,6.1376,9.8196,5.8127,5.551,5.8785,5.7005,18.7875,5.6768,11.8105,8.769,5.8829,7.453,10.6996,8.148,7.6888,7.673,7.0729,8.427,7.7428,7.9042,7.681633
Cara Mudah Penulisan Karya Ilmiah Dengan Microsoft Word 2010,5.6461,2.9669,2.434,2.5609,2.7234,2.3453,2.4979,2.2982,2.4239,2.3563,2.2907,2.5314,2.2892,2.5772,2.3557,2.3106,2.5447,2.7649,2.773,2.349,2.389,2.3359,2.3179,6.7573,2.6127,2.2837,2.5181,2.5929,2.3057,2.6338,2.72621
Metode Statistik Untuk Ilmu dan Teknologi Pangan,3.405,3.4575,3.2496,7.8116,4.1441,3.5579,3.4423,3.2477,5.808,2.9453,9.3382,3.6381,3.4297,3.3356,3.9462,4.4406,3.3156,3.2976,3.0869,3.4333,5.5062,3.9896,3.3449,3.6797,4.1172,3.292,3.5079,4.2868,7.0961,6.8058,4.265233
"Peran Heritage Engineering Dalam Pembentukan Branding Kota Tua Ampenan, Mataram  NTB",4.0422,3.2138,4.0804,3.508,6.1904,3.9188,3.7528,3.3562,3.902,3.9735,3.4684,4.2535,4.5278,3.2965,3.3113,3.26,3.6511,3.5613,3.2839,3.4699,3.642,3.8188,3.4766,7.0746,4.3723,3.7635,3.8507,6.0161,3.5557,3.3976,3.966323
Analisis Sensori Lanjut untuk Industri Pangan dengan R Preference Mapping dan Survival Analysis,4.9397,4.5749,7.7111,5.1867,4.4965,4.457,4.6317,4.2476,4.5791,4.6189,5.6117,9.1761,5.0027,5.1545,5.3703,4.6144,4.5415,4.7652,4.6511,4.4949,4.9293,4.9054,4.5184,4.6003,4.5518,4.3516,4.4264,4.5254,4.4176,4.44,4.949727
Innovative Cases of Organic Agriculture in Asia,5.6383,6.8319,5.8607,4.9656,6.0572,5.7204,10.1564,7.8518,5.3776,5.4151,6.0638,5.2724,4.9357,5.4892,5.5269,5.2815,5.904,5.6106,6.6099,5.1762,5.9619,5.6237,6.3268,5.7161,5.6565,6.11,4.8488,10.4685,7.2514,4.8574,6.085543
Panduan Praktis Pendugaan Umur Simpan Produk Pangan,4.2579,5.2356,4.0222,6.6486,6.3976,4.2709,3.9497,3.775,5.4202,7.1616,4.0977,4.5131,3.9187,3.9257,4.5291,5.5902,4.0437,4.2718,7.0314,6.318,6.4864,3.8926,4.4067,4.3713,3.9848,4.175,3.9698,7.5369,5.3708,3.9625,4.91785
"Pengembangan Geowisata Di Cianjur: Tinjauan Stabilitas Lereng, Air Bersih Dan Sanitasi Situs Gunung Padang Untuk Branding Destinasi",8.8728,8.9125,8.3209,6.9551,7.2955,6.8709,7.8951,9.515,8.1535,12.3287,10.6759,11.061,11.187,10.8088,9.9799,10.1854,7.7411,11.442,8.5619,7.1316,7.235,7.4899,7.2401,8.811,7.0756,10.5451,7.844,7.1031,7.0286,7.6481,8.730503
"Bakrie International Conference on Communication, Management, Politics & Accounting (BICOMPACT 2023) Theme:"" Advancing Sustainability: Strategic Approach for A Changing World """,8.1219,8.3416,5.3963,7.1297,10.7051,6.8776,6.703,5.6377,12.107,6.8283,5.4539,5.9414,5.504,9.0403,5.8576,6.045,9.9013,6.1932,8.2808,5.5806,5.5174,7.8218,6.9727,6.5933,10.6609,7.639,5.6577,11.51,9.3723,7.5714,7.49876
Manajemen Optimalisasi Peran BUMN Republik Indonesia,5.1064,5.5431,8.4847,7.5056,5.4181,5.5325,5.5487,5.1892,4.969,4.9678,5.0108,5.0836,9.8403,5.4054,5.1874,5.5533,5.0394,5.0303,4.8817,5.1365,5.0468,4.9441,5.7402,5.1335,5.1103,9.1049,4.9586,5.7821,7.3308,4.8552,5.74801
Bekatul (Rice Bran) sebagai Pilar Pangan Fungsional dan Nutrasetikal,4.0903,3.5538,3.7937,6.3499,6.0435,3.8438,3.6067,5.298,8.6313,3.9656,4.6812,3.9263,3.6273,4.6595,4.7858,6.9086,3.9536,3.7131,3.9729,3.9173,6.2566,6.3255,3.5219,6.8037,8.0509,4.936,6.0358,4.8813,6.5696,4.1644,5.02893
Kepemimpinan dan Identitas Positif: Penggerak Perubahan Organisasi untuk Agenda Keberlanjutan asdasdasd,12.0348,8.0288,6.9119,7.1333,8.4181,8.7313,10.313,10.7077,8.7618,8.2791,6.5894,8.2756,8.7922,7.7572,6.5311,6.5215,6.3008,7.1267,13.5701,10.4275,12.1132,9.9845,7.6317,7.8317,10.3067,8.999,7.3898,7.1166,10.247,9.7939,8.7542
"Pemanfaatan Sumber Daya Hayati dengan Penerapan Teknolog yang Berkelanjutan Sebagai Upaya Mencapai Zero Waste, Circular Economy dan Pengurangan Risiko Bencana",8.6475,8.6916,7.0785,7.0011,7.1978,6.9074,8.932,8.897,6.9965,6.9157,11.7109,6.973,8.5657,10.3341,7.9646,7.1969,6.3843,11.3168,6.4829,11.3391,6.6565,8.7611,9.7222,7.5539,11.9673,11.7613,6.8311,6.6016,13.7777,10.6523,8.660613
Statistik Pertanian Organik Indonesia,4.8438,4.509,5.4907,5.4816,4.6536,5.7724,5.1474,4.4944,6.7949,7.3487,4.8704,5.2907,4.732,4.6778,5.9503,7.4235,7.1336,6.9314,4.9968,5.0038,4.4335,5.2793,4.7012,4.6777,4.716,4.6901,6.9702,4.6668,6.1297,9.3829,5.57314
Dinamika Struktur dan Aplikasinya dengan Software Mathematica,4.2923,3.9285,4.4459,4.2524,4.4305,6.7531,5.115,4.94,5.0039,5.9521,5.0159,4.2547,4.0883,6.5847,6.378,5.0731,6.6919,10.7781,7.7629,5.2613,6.1841,5.0977,4.3461,5.433,5.6519,4.1971,8.4344,6.779,6.7421,4.7268,5.619827
TERMODINAMIKA TEKNIK DASAR-DASAR KONSERVASI ENERGI BAGIAN 1,6.319,8.2684,6.2472,9.9881,6.7136,7.2886,6.7528,6.702,8.9354,6.6364,6.3888,6.4161,6.6526,6.5655,7.4699,8.519,7.5205,6.2612,7.1565,6.831,6.1294,6.7674,6.1083,6.2108,6.2382,6.2702,6.2821,6.2511,9.8393,6.6886,7.013933
NYALA DUKUNGAN DARI INDONESIA UNTUK PALESTINA,2.9826,2.489,2.7901,3.8829,3.0001,4.2868,7.6228,2.8603,2.8089,2.6259,2.7447,3.4052,3.4088,2.793,3.0026,4.0427,3.4612,2.689,2.6775,3.7681,2.7986,2.824,2.7907,2.7125,6.2829,2.6289,3.2742,4.7557,3.9856,3.3662,3.425383
STRATEGI PERCEPATAN SISTEM PEMERINTAHAN BERBASIS ELEKTRONIK (SPBE) Guna Mendukung Terwujudnya Tata Kelola Pemerintahan yang Baik,5.0008,5.6924,5.5809,7.6087,5.9572,5.3549,6.7505,5.4484,5.2182,6.8173,6.1159,6.2489,5.433,5.7999,5.9567,5.2652,6.7076,8.8501,10.3377,7.4352,6.1203,7.4639,5.8261,5.3993,5.899,9.5638,6.109,5.87,5.8321,8.0828,6.458193
PENGEMBANGAN PROFESI KEGURUAN,7.0882,5.7695,5.5978,6.3943,5.5764,5.5859,6.596,5.7312,6.1864,5.959,5.5077,6.7759,6.2326,5.6613,8.0401,5.959,6.1181,6.0622,5.8302,5.8402,5.5799,5.572,5.8505,5.5694,5.9599,6.7485,6.1423,7.0078,5.9715,13.5764,6.349673
Integrasi Sistem Informasi dalam Business Process Management,6.5231,5.4921,13.4359,7.4108,6.1764,5.2771,4.2633,4.5978,5.5938,5.3215,4.3924,5.2399,4.9609,4.5363,4.5424,5.6214,9.0431,5.459,4.5864,4.5166,4.8321,4.4287,4.7182,5.8724,4.8483,4.2797,8.0712,6.7597,4.7267,5.3766,5.696793
Peran Kecerdasan Buatan pada Kesehatan Masyarakat Global,3.0179,3.0339,3.2474,7.7388,3.1224,3.184,3.3633,3.7346,3.4999,3.1727,3.4659,3.1413,3.3958,3.2553,3.2409,3.6068,3.2592,3.4568,4.8733,3.5033,3.2717,3.1572,3.1854,3.1214,3.646,5.1359,3.7558,3.2933,3.5834,4.015,3.615953
Penghargaan Achmad Bakrie XX-2024,6.4119,5.492,6.7146,6.4951,5.4116,5.5886,5.3219,5.3706,9.0461,8.0862,5.5245,7.372,7.814,5.4803,6.8298,5.9147,6.0413,7.8794,8.4029,6.8114,5.7313,8.5159,9.8923,13.8866,8.5116,6.5612,7.9252,7.5758,5.7835,7.6826,7.13583
PANDUAN PRAKTIKUM EVALUASI SENSORI,5.2103,4.2132,4.2932,5.6635,3.7971,4.5671,4.5893,3.6544,4.5168,3.9091,3.7273,4.0496,3.9986,6.0232,3.6369,3.771,4.5235,3.6408,8.003,3.9214,4.1017,3.9148,7.5355,3.7305,5.7308,4.0806,4.5646,4.009,3.9057,4.1812,4.515457
Mengintegrasikan Knowledge Management dalam Agenda SDGs: Solusi untuk Tantangan Global di Era Digital,9.024,8.5309,17.6159,11.9384,10.969,10.1019,9.6596,7.518,16.939,10.7259,7.5698,10.6012,7.365,9.2067,8.1873,8.6409,7.5652,13.5059,9.4896,10.0954,7.6177,9.9071,7.5825,8.0522,7.5224,12.2099,9.0786,8.7776,9.2931,11.4124,9.890103
"Kekuatan Formula 7 ( Tujuh ) Dimensi Kehidupan: Menciptakan Keselarasan Untuk Sukses Dalam Hidup Yang Seimbang, Bahagia, Dan Produktif",5.4358,5.5926,8.8284,6.1851,5.7907,6.1892,5.3254,5.1591,6.7405,7.3928,6.4651,8.4219,9.4635,6.5986,5.9118,7.3834,7.6905,5.6202,5.1297,5.621,8.4706,7.6858,7.8619,5.112,9.0568,5.1341,7.8903,5.4683,5.6889,7.8652,6.705973
Rahasia dan Strategi Cerdas Mengelola Keuangan Digital Melalui Pinjaman Online (PINJOL),6.7178,5.1223,5.3663,5.2871,3.8563,4.188,4.1652,4.003,4.1728,4.1256,8.0039,4.2732,6.3766,4.2908,6.0984,4.5976,4.2396,3.9897,3.8889,5.1258,8.0786,4.3363,4.5738,3.9323,4.0977,4.8162,5.1102,3.9934,7.1603,4.1684,4.938537
Temukan Kekuatan dalam Tulisan,3.8633,3.3312,3.5541,3.6259,3.7853,3.9944,3.3893,3.5347,3.5573,7.328,3.9702,3.6258,5.8495,3.3926,6.5841,5.1057,3.9778,3.459,4.2555,4.783,3.8117,3.5624,4.1027,3.706,3.967,3.4844,3.776,3.6287,3.6126,6.1574,4.159187
,,,,,,,,,,,,,,,,,,,,,,,,,,,,,,,5.365247509
