Judul yang Diuji,Run_01_ms,Run_02_ms,Run_03_ms,Run_04_ms,Run_05_ms,Run_06_ms,Run_07_ms,Run_08_ms,Run_09_ms,Run_10_ms,Run_11_ms,Run_12_ms,Run_13_ms,Run_14_ms,Run_15_ms,Run_16_ms,Run_17_ms,Run_18_ms,Run_19_ms,Run_20_ms,Run_21_ms,Run_22_ms,Run_23_ms,Run_24_ms,Run_25_ms,Run_26_ms,Run_27_ms,Run_28_ms,Run_29_ms,Run_30_ms,Rata_rata_ms
Diplomasi Indonesia dalam Mendukung Kemerdekaan Palestina,8.1559,8.6852,9.062,8.0685,7.7859,8.4234,9.6914,7.9813,14.3438,9.0025,9.2426,13.5783,12.0763,9.1057,9.2131,9.0173,11.9286,11.7036,11.0679,11.1764,9.4583,8.6185,8.294,9.9318,10.8543,9.7612,8.4271,9.2019,8.9304,12.9297,9.85723
Ali & Lili,2.9098,2.8054,3.1776,3.4268,4.1639,3.7718,3.5411,4.6957,2.743,2.7571,2.7624,3.1124,2.825,3.131,3.0676,3.2174,2.7679,2.7754,3.3626,3.1167,2.8072,3.3185,2.8122,3.0964,2.7345,2.8323,2.8812,2.8157,3.2562,3.5293,3.14047
Ide-Ide Pemikiran dari Kampus Maroon 2024,6.7469,6.1866,6.7782,6.4276,6.2336,10.0853,6.3645,8.5383,11.3742,6.3946,7.3948,6.1488,6.1566,10.9245,11.6891,6.2132,6.2823,11.1671,9.7039,7.6639,6.1699,11.2283,6.7213,8.9091,6.2841,7.6723,5.95,7.5587,6.8141,5.9341,7.723863
Mitigasi Risiko Proyek Konstruksi di Indonesia,9.6501,8.6232,8.7397,7.1289,8.1238,7.0952,8.8324,10.3643,8.4384,7.9718,7.1121,10.5075,7.131,10.4368,6.9666,7.3294,7.0323,7.1224,7.0335,7.3362,7.0627,6.9304,9.7991,7.8135,8.0265,7.5636,7.1209,6.9758,7.8982,6.7386,7.963497
"Manajemen Sumber Daya Manusia: Berbasis Teknologi, Menuju Ekosistem Hijau dan SDGs",13.4144,13.8438,9.897,9.5902,8.5255,9.0039,8.729,9.4317,11.4669,9.3586,9.4543,9.253,16.0122,11.4125,14.8287,11.7032,12.6863,11.0019,11.7028,10.026,12.8047,9.4234,9.3969,9.5462,9.8389,9.9613,10.0316,16.2765,9.923,9.571,10.93718
Akal Yang Mengandung Hikmat,4.8696,4.4071,5.0521,3.9035,3.71,3.6316,3.7312,3.7548,3.8986,5.2155,5.6004,3.7549,5.8976,4.6836,3.5677,3.4654,3.869,5.1316,4.0448,4.3487,6.4826,5.9354,4.2774,4.1155,4.6146,3.8536,3.5898,3.7132,3.737,3.7316,4.352947
79 Esai Aksi Bersama Wujudkan 17 SDGs,2.5591,3.2105,2.3436,2.1553,2.3447,2.152,3.01,2.7549,2.1771,2.7189,4.6805,3.3898,3.1552,2.4258,2.5568,2.8818,2.3625,2.2109,2.1369,2.1461,2.1769,2.24,2.3802,2.7749,2.4907,2.3412,2.1437,2.2943,2.3683,2.2129,2.55985
Penghargaan Achmad Bakrie XX-2024,10.6523,11.5015,10.8186,12.541,9.8865,9.6299,11.6245,10.8746,14.8297,10.4485,11.6497,10.8127,10.6655,12.0974,11.8387,11.9317,12.1714,9.7258,11.1494,10.2899,10.5814,10.7974,12.9152,9.7065,11.0517,9.683,10.063,10.4912,11.4544,10.8334,11.09055
Arunika: Bunga Rampai Ilmu Komunikasi Perilaku Komunikasi Gen Z  Seri 2,8.2304,11.5307,11.4183,11.001,11.2142,8.8411,9.7837,9.7924,8.6477,8.6765,8.6327,16.4289,8.9749,11.0587,11.352,10.538,12.1835,12.5257,11.2461,9.0561,10.5077,11.8768,8.7055,8.8185,8.8483,10.7164,8.5986,8.8183,8.779,8.3439,10.17152
Belajar Hidup Minim Sampah Mulai Dari Dapur Rumah,6.3983,7.0318,6.2572,6.1715,9.8036,7.6416,6.7033,6.3289,7.7916,7.6468,7.6602,6.6551,6.621,6.4981,7.9595,6.6656,8.0864,10.0895,7.7591,6.866,7.0099,7.0575,7.3835,6.9194,6.5893,7.1588,8.597,6.5604,8.7448,7.7445,7.346673
Desain Percobaan: Teori dan Aplikasi,6.6733,6.5537,6.9389,6.0322,8.9566,5.908,6.0318,6.2227,6.0472,6.1747,6.2948,5.868,6.7058,7.48,6.1604,7.5631,5.967,6.4885,10.1538,7.1756,6.1464,6.0685,6.4565,10.4803,6.1949,7.6963,6.2647,6.7955,7.9594,6.1403,6.853297
"Wanita Masa Depan: Peran, Identitas, Dan Kontribusi Dalam Menghadapi Tantangan Kehidupan",6.8083,9.1985,7.4948,7.3307,6.7389,7.6162,7.3178,10.4449,9.3888,6.9883,6.3612,6.5012,7.5627,6.5294,7.8276,9.9383,6.8262,6.5137,6.7279,8.3389,6.4978,6.4887,6.3303,10.5126,6.1991,6.3681,14.7546,8.7589,8.3778,7.2106,7.798427
Jalan Kebijaksanaan: Mengatasi Kesulitan Dan Menginspirasi Kehidupan,12.6502,10.3738,12.8377,10.082,11.5101,8.1596,7.4174,9.7963,8.9565,14.2843,9.1661,9.7198,10.3087,10.187,9.7399,11.1967,11.821,8.6792,10.5646,9.7634,10.9543,9.4834,15.819,14.8249,19.2501,11.926,10.853,11.9758,11.6063,10.9739,11.1627
Cerita dari Perguruan Tinggi,6.7429,5.989,5.5501,5.8741,5.6356,5.8259,6.588,5.8414,6.0119,8.7021,7.3155,6.2999,6.1447,5.7359,6.0784,7.3178,6.1603,6.2244,6.5464,5.6202,6.0293,5.6608,5.1623,5.5434,5.1615,7.0154,5.6399,5.0581,5.5919,5.4534,6.084017
Tinjauan Teknis Kajian Prastudi Kelayakan Proyek KPBU Fasilitas Pengelolaan Limbah Bahan Berbahaya dan Beracun dan Sampah Spesifik Secara Terpadu Kalimantan Timur,10.1339,9.6838,11.2496,10.6525,19.4689,11.5852,11.9063,14.3473,14.5717,11.8635,10.3965,12.1057,10.4725,9.662,13.1336,9.5444,14.1596,13.8175,12.4607,12.4306,10.2441,10.7142,12.4613,11.8368,12.6258,10.9953,11.77,12.4695,10.9722,11.4992,11.974473
Global Organic Agricultural Innovations,5.8155,6.1363,5.727,5.9338,6.3336,5.8134,6.3388,7.8615,6.2411,7.1116,5.5047,5.4938,7.6441,5.6867,6.2259,5.683,6.147,6.318,6.0662,6.982,5.537,6.2866,7.428,8.9698,6.0764,9.7656,9.2437,5.9766,8.4679,6.9413,6.658563
Arunika: Bunga Rampai Ilmu Komunikasi Perilaku Komunikasi Gen Z,7.7925,10.6156,17.2245,12.9198,11.1904,10.4671,8.656,10.2011,11.0521,13.9183,10.2945,21.5326,9.5231,10.6398,12.6676,9.1741,8.5365,8.6611,8.3837,11.4802,8.3172,9.215,8.5061,12.8731,8.7561,8.1617,8.5908,10.6113,9.2768,9.5019,10.624687
Cerita Para Mahasiswa,6.743,7.5491,5.3694,5.4178,8.9493,5.8122,5.441,5.4768,5.9613,5.3043,5.3494,5.8116,9.3128,7.9671,8.8361,5.9812,5.4494,8.3545,5.2499,5.8685,10.772,5.5032,9.7225,6.1511,5.6099,9.4232,5.4129,5.7366,5.6573,9.8978,6.80304
Cerita Semasa Kuliah,5.7214,5.9436,5.7306,5.4933,5.5452,5.5903,5.3336,5.4397,6.0202,5.5212,7.7997,5.613,8.1109,6.2168,5.4621,5.3712,8.3562,5.4195,5.7882,5.8969,5.4375,8.669,5.4142,5.4408,5.4907,5.82,5.569,5.3471,6.3289,6.1899,6.00269
Cerdas Mengelola Kebun Hingga Sampai Dapur,7.3387,7.0903,9.1227,6.423,6.8503,5.754,6.132,7.7627,5.6591,8.3208,5.9359,9.7241,5.6136,10.047,5.565,5.6924,6.6038,6.1977,6.9658,6.3934,6.4626,5.5331,6.9091,7.2486,8.339,7.2819,8.2232,8.0009,5.7979,6.1462,6.97116
Statistik Pertanian Organik Indonesia,11.6958,10.2727,8.4626,10.6366,11.8622,8.0373,10.6462,9.5736,9.8554,15.418,10.3051,11.5788,11.7353,8.4299,8.7136,8.0402,10.6362,11.2627,12.4195,9.9006,8.5435,12.6581,16.9317,11.8721,10.5949,8.5449,8.3045,10.0503,10.8877,12.432,10.676733
Arunika: Bunga Rampai Ilmu Komunikasi All About Communities,8.1281,9.418,11.685,9.5199,12.4894,8.8046,8.4634,10.6516,10.6303,8.8988,7.708,9.9498,11.3869,8.8933,8.7762,7.7735,7.9361,7.9446,9.0122,9.5005,9.7661,8.3332,9.3909,10.4132,9.9263,9.6289,9.0432,7.8573,7.7081,8.2373,9.26249
"Meningkatkan Produktivitas: Panduan Praktis Untuk Sukses Dalam Pekerjaan, Karier Dan Kehidupan Anda",11.6983,14.3009,12.6034,13.1032,15.6749,13.8477,14.1822,11.9019,11.5266,12.0666,15.2662,14.3465,12.8357,12.3165,11.7704,11.7976,12.1141,12.1245,12.2379,13.9743,14.1096,13.1304,12.4446,15.365,11.5363,13.6625,11.884,12.574,13.7416,12.3942,13.01772
Proyek Tepat Waktu: Menyingkap Faktor Keterlambatan Dan Solusi Proyek Konstruksi Di Indonesia,6.319,6.2855,7.2113,7.789,9.4442,7.7354,9.7439,8.0414,10.7171,8.3543,8.9256,9.9754,7.9239,7.5853,8.4133,6.9335,8.6047,8.2827,7.0667,6.2144,13.2183,6.6417,9.262,7.0299,7.6801,6.0073,9.0319,6.6527,8.2285,7.8288,8.104927
Buku Panduan Pemilu 2024: Edisi Pemilih Disabilitas,4.5159,4.475,3.8422,3.8388,4.0938,3.8658,3.7559,4.0887,3.9929,5.1192,4.188,4.7523,4.2908,4.002,4.1325,4.1451,4.276,8.5745,4.0863,4.9547,4.4059,5.446,4.6,5.3453,4.5217,7.6151,4.5792,4.1229,3.8491,4.815,4.609687
Data Structure Vol. 1,4.8975,4.5453,4.7732,5.8407,4.7828,4.6878,6.0176,4.6021,4.9469,6.3912,5.1718,5.0999,5.0767,7.794,5.6785,9.5705,8.1995,5.4821,4.8707,5.1853,5.5085,5.3581,4.5805,4.5368,4.7006,4.575,4.9156,7.3975,5.0988,7.5521,5.594587
"Analisis Sumber Daya Manusia, Pengangguran Dan Kemiskinan Di Indonesia",9.081,11.0506,10.8114,10.759,12.2362,9.412,8.3725,7.9573,8.3099,13.7036,8.6161,11.2047,9.1187,7.8694,12.1559,7.6965,12.4417,7.4338,11.1466,10.8995,11.0357,10.2904,12.4521,11.8993,12.3284,8.2129,8.8402,12.2266,12.0236,10.2113,10.326563
Reorientasi Kebijakan Pertanian Organik Sesudah Go Organik 2010 dan Program Seribu Desa Pertanian Organik di Indonesia,11.5249,14.4551,11.2585,13.3018,11.956,13.4312,14.785,15.0739,12.2205,12.1624,12.9607,14.2755,13.0634,10.5539,24.7664,12.9163,16.7897,14.1935,12.9982,12.7592,14.3009,12.1804,15.7429,12.4567,18.5323,16.1716,11.6604,10.8057,11.3128,12.1209,13.691023
Pemanfaatan Ekowisata sebagai Strategi City Branding Kabupaten Pinrang,11.7231,13.5638,13.1524,10.1563,10.297,11.5618,10.2227,13.5121,13.0666,11.36,10.3731,9.389,15.7848,11.0223,10.5298,12.1854,12.9914,21.614,15.1387,13.4582,11.7189,17.1507,11.5984,9.8421,9.6078,9.409,11.6338,10.1225,10.236,13.3142,12.191197
Cara Mudah Penulisan Karya Ilmiah Dengan Microsoft Word 2010,4.4262,4.6093,5.0732,4.237,8.0044,4.0211,4.0612,4.2248,4.524,5.9042,3.823,4.1323,3.8505,3.9654,4.432,7.1984,4.42,4.23,3.9363,4.6858,4.1715,3.8353,3.9913,4.2808,4.1064,4.4068,6.2224,4.7854,4.5414,4.1152,4.607187
Metode Statistik Untuk Ilmu dan Teknologi Pangan,6.3738,6.8672,7.9654,6.6338,6.9422,5.3967,5.218,6.6892,5.4508,5.5354,6.4638,7.207,8.3005,6.2109,6.4278,5.443,5.3019,5.7057,5.4755,5.5898,10.9017,6.9448,6.3495,6.8468,6.1147,9.4489,9.0034,8.5221,10.6204,9.9879,6.997953
"Peran Heritage Engineering Dalam Pembentukan Branding Kota Tua Ampenan, Mataram  NTB",7.4457,6.0335,5.9397,7.7621,5.7113,5.6834,7.7542,6.5224,6.5713,8.2329,5.7944,7.9847,5.8947,5.6121,9.732,5.9757,9.2764,7.405,5.6166,8.0847,6.0675,6.0226,5.5851,6.8503,5.7124,6.0164,5.4322,5.4322,5.8051,8.0422,6.666627
Analisis Sensori Lanjut untuk Industri Pangan dengan R Preference Mapping dan Survival Analysis,10.4106,12.0524,9.1825,14.0322,14.0162,9.0293,8.5764,10.9526,8.3553,12.048,9.7748,7.6642,9.6979,8.4181,7.764,9.0852,7.6579,8.3523,8.1969,13.7959,11.7152,7.6241,12.1428,9.8734,9.4759,7.7858,7.9377,10.8388,8.9841,9.7263,9.838893
Innovative Cases of Organic Agriculture in Asia,8.463,8.6738,8.5866,8.8187,9.3271,12.7083,13.1157,13.3704,8.9048,9.0127,9.3441,8.4548,8.3169,8.406,8.693,8.4504,8.5414,10.8663,9.281,8.6122,9.3811,8.6056,12.8968,12.6685,9.5156,8.8471,9.3592,12.6174,8.6875,12.2951,9.82737
Panduan Praktis Pendugaan Umur Simpan Produk Pangan,8.7402,7.6839,11.1917,6.7932,7.4445,7.1434,6.917,6.8867,6.6333,7.4178,12.4081,10.4527,7.4326,6.7699,6.5349,7.8481,6.7226,10.593,6.9027,6.4825,7.4249,7.5724,6.6287,6.6545,6.9808,7.4204,7.2164,7.4904,7.98,16.9216,8.042963
"Pengembangan Geowisata Di Cianjur: Tinjauan Stabilitas Lereng, Air Bersih Dan Sanitasi Situs Gunung Padang Untuk Branding Destinasi",34.8759,14.2314,18.6746,14.5082,15.0841,13.8465,11.489,11.8595,11.9307,19.0424,14.9303,17.5254,14.0216,14.6533,13.1222,12.0359,14.5903,13.0579,13.8528,12.1849,12.1572,15.2737,14.2331,12.1232,16.3757,15.1731,11.8061,15.4614,11.8798,16.1526,14.87176
"Bakrie International Conference on Communication, Management, Politics & Accounting (BICOMPACT 2023) Theme:"" Advancing Sustainability: Strategic Approach for A Changing World """,9.5173,9.5244,9.1847,15.6918,13.9366,9.972,9.9867,10.9797,9.9723,11.3841,9.5503,14.0153,9.9551,9.8184,9.3842,9.9718,9.7867,12.4019,13.0187,13.4377,14.0018,11.9617,10.0216,10.0144,10.4587,11.0833,10.9347,12.0574,10.5346,11.9276,11.149517
Manajemen Optimalisasi Peran BUMN Republik Indonesia,13.4384,13.8431,12.4938,10.9479,10.6188,9.262,10.6097,9.4221,10.5603,11.0781,16.638,9.3556,9.8696,10.0839,11.899,14.4389,10.1125,11.4994,9.9871,12.3412,12.392,8.6964,8.7982,8.7616,13.7497,9.3888,12.5006,9.853,9.3065,9.2454,11.03972
Bekatul (Rice Bran) sebagai Pilar Pangan Fungsional dan Nutrasetikal,6.2956,6.7907,15.1155,6.9695,13.1777,9.0449,8.6566,7.4117,6.8797,8.2108,8.3902,8.8966,8.2396,7.194,6.7932,7.3978,6.8123,6.8221,6.719,8.3542,7.613,7.1818,6.8583,7.5959,12.8034,10.9755,6.9627,6.9381,10.9935,8.7444,8.361277
Kepemimpinan dan Identitas Positif: Penggerak Perubahan Organisasi untuk Agenda Keberlanjutan asdasdasd,11.8725,12.2042,14.0122,11.3656,13.5718,12.3575,15.8657,15.4508,12.7903,11.8459,11.3402,11.4104,14.1501,11.5757,13.8039,11.7053,12.824,11.7665,11.655,14.158,15.2858,11.545,19.6265,13.6716,12.7644,11.7836,11.7699,24.4439,12.9295,21.384,13.69766
"Pemanfaatan Sumber Daya Hayati dengan Penerapan Teknolog yang Berkelanjutan Sebagai Upaya Mencapai Zero Waste, Circular Economy dan Pengurangan Risiko Bencana",16.3428,19.7425,14.382,14.7743,15.8134,17.2667,12.4777,19.7129,15.7337,13.5689,13.2397,12.0789,21.1297,16.7779,12.0028,18.4786,13.6065,14.7356,11.4919,12.7327,13.8263,13.3142,13.6499,12.0881,13.5795,12.5882,12.0808,12.6702,15.7323,12.3203,14.597967
Statistik Pertanian Organik Indonesia,8.5371,11.6829,10.4013,8.8182,10.7934,8.9978,8.9013,13.0317,10.3488,8.4311,10.4637,10.1757,9.5597,9.2944,11.5804,8.2401,8.8363,10.2063,11.944,11.2345,8.765,7.9448,7.8063,7.7818,8.1588,9.8589,8.466,8.7186,9.0393,8.7269,9.55817
Dinamika Struktur dan Aplikasinya dengan Software Mathematica,7.2047,7.1403,10.3434,7.4436,9.6458,8.1619,9.484,9.8497,6.9074,8.9664,10.4506,12.9239,10.0065,8.1926,8.3469,10.2456,11.4472,12.0562,10.3578,10.0197,7.6006,10.8496,9.8664,10.0882,7.4372,8.19,8.5251,8.0673,9.6562,11.0232,9.349933
TERMODINAMIKA TEKNIK DASAR-DASAR KONSERVASI ENERGI BAGIAN 1,20.3344,13.4595,14.4642,11.6742,11.7035,12.0462,14.3638,15.128,17.1095,15.891,13.6882,11.2046,11.1502,12.1906,16.3922,12.7465,12.9009,12.0039,10.9838,11.5351,14.1709,16.3084,15.0528,11.6327,13.4916,14.797,18.1057,12.9318,10.8954,10.8825,13.641303
NYALA DUKUNGAN DARI INDONESIA UNTUK PALESTINA,4.5431,4.6351,5.2184,7.0691,4.9264,4.8468,4.6662,5.4919,8.6148,5.3847,5.8855,4.9117,7.7641,4.5439,4.4122,4.7052,5.3879,4.409,4.5794,4.8579,4.4016,4.3909,6.7931,4.5521,4.5488,4.5427,4.3394,4.4811,5.2208,6.1719,5.209857
STRATEGI PERCEPATAN SISTEM PEMERINTAHAN BERBASIS ELEKTRONIK (SPBE) Guna Mendukung Terwujudnya Tata Kelola Pemerintahan yang Baik,8.9383,8.4169,9.2231,8.6893,8.9333,12.6345,8.5354,8.6553,8.7734,12.331,12.5419,9.9257,11.4778,8.925,9.3115,8.8405,8.7547,8.9719,9.5284,9.2532,8.5493,11.4734,8.9507,8.8017,12.5597,11.8774,9.9331,15.4685,13.8632,12.216,10.211803
PENGEMBANGAN PROFESI KEGURUAN,10.1218,13.4086,17.323,16.3636,14.5903,13.9406,10.2373,10.7527,10.4801,11.482,10.4378,10.1679,11.7441,11.1313,11.3372,13.9669,10.8811,11.4832,10.9745,10.4655,10.2974,12.0692,12.5188,9.8146,9.8148,10.4758,11.0723,11.9046,10.6503,11.145,11.701743
Integrasi Sistem Informasi dalam Business Process Management,8.5428,8.5491,8.4482,8.8181,8.3798,9.4459,10.672,9.7975,9.1482,8.0435,10.9669,13.4063,10.3899,10.5634,15.0918,8.0828,7.9681,10.8628,8.5166,9.1642,10.0025,9.1259,8.3966,7.8756,9.8737,7.8201,12.7004,8.1476,7.5723,8.3259,9.48995
Peran Kecerdasan Buatan pada Kesehatan Masyarakat Global,5.517,5.9104,5.7789,5.4056,5.9154,7.5859,9.1331,6.233,6.0143,7.2577,5.45,9.9988,5.7306,5.265,7.1057,5.7234,7.9135,9.3172,6.2842,20.1405,7.1699,5.381,5.8456,16.1334,6.7257,7.2251,7.2667,7.0222,6.0477,5.247,7.391483
Penghargaan Achmad Bakrie XX-2024,9.0331,12.0148,13.7707,9.4162,10.1527,9.3618,9.6126,13.3149,10.0619,9.5133,13.5117,10.0101,11.4051,9.1189,15.6632,11.7778,11.2521,11.2154,10.1133,9.8869,11.8961,10.461,21.7454,15.7246,12.6451,9.4942,11.326,12.2105,11.0503,9.971,11.55769
PANDUAN PRAKTIKUM EVALUASI SENSORI,8.3747,6.9477,7.371,8.2506,6.8794,6.8367,7.0422,6.7548,6.7174,9.0946,7.3556,7.6774,8.2685,6.8968,6.9501,6.7714,6.7679,8.9567,8.0946,7.3385,11.8175,9.8805,8.2102,6.7968,7.3088,8.1481,7.1755,7.8531,6.776,6.774,7.66957
Mengintegrasikan Knowledge Management dalam Agenda SDGs: Solusi untuk Tantangan Global di Era Digital,17.5208,13.2744,17.7281,16.3739,14.2302,17.7317,13.8777,14.0566,14.3908,15.0681,17.1444,15.8484,14.5979,15.037,20.358,13.7842,13.9468,13.1176,14.7444,15.6014,13.6747,15.0678,14.0422,16.5716,19.3613,13.7762,15.5513,14.1578,17.1915,13.7075,15.384477
"Kekuatan Formula 7 ( Tujuh ) Dimensi Kehidupan: Menciptakan Keselarasan Untuk Sukses Dalam Hidup Yang Seimbang, Bahagia, Dan Produktif",9.3816,9.0743,11.1324,11.8378,13.508,8.7255,12.7777,9.552,14.9579,10.18,13.0838,14.6338,14.3404,16.8592,12.8057,13.3143,13.8226,11.4046,13.4982,11.2536,8.6799,8.4344,8.8941,8.6397,8.554,13.8473,12.5873,8.7678,10.9719,11.6114,11.57104
Rahasia dan Strategi Cerdas Mengelola Keuangan Digital Melalui Pinjaman Online (PINJOL),7.7811,13.989,10.8865,7.5225,6.8601,6.897,7.827,8.7069,8.2143,9.2116,11.7114,11.1816,10.5677,10.7957,11.1763,11.6657,9.7385,10.4758,7.1784,7.3473,7.2226,7.152,7.2742,8.4291,17.4317,12.557,7.3546,7.3188,7.7604,10.2419,9.41589
Temukan Kekuatan dalam Tulisan,5.9165,7.7116,6.9632,7.4069,5.8693,7.2261,6.0139,6.0685,7.5069,6.0918,6.1747,6.0111,6.5467,6.1525,5.8335,6.783,9.9536,6.3176,15.2561,6.6723,6.0577,6.299,6.198,6.0305,7.014,9.6965,6.4914,9.6008,6.1485,5.8551,7.062243
,,,,,,,,,,,,,,,,,,,,,,,,,,,,,,,9.135741945
